<?xml version = "1.0" standalone="no"?>
<!DOCTYPE template SYSTEM "../dtd/file_template.dtd">

<template type="class" name="Csharp">
    <file_extension>cs</file_extension>
    <comment>
        <open>/*</open>
        <close>*/</close>
        <inline>//</inline>
    </comment>
    <variables prefix="" import_code="using {{import_file}};">
        <variable type="int" code="int" init="0"/>
        <variable type="string" code="string" init="null"/>
    </variables>
    <imports>
        <import>System</import>
    </imports>
    <code>
        /*
        {{comments}}
        */

        /*
        {{license}}
        */
        {{stdlib_imports}}
        {{other_imports}}
        namespace {{namespace_name}}{
            {{classes}}
            class {{main_name}}{
                public static void Main(string[] args){
                    {{local_var}}
                    {{input_content}}
                    {{filtering_content}}
                    {{flaw}}
                    {{sink_content}}
                    {{exec_queries_content}}
                    {{static_methods_calls}}
                    {{other_classes_calls}}
                }
                {{static_methods}}
            }
        }
        </code>
</template>
